[
  {
    "onboardingId": "ONB-a1b2c3d4",
    "operatorId": "OP-a1b2c3d4-e5f6-7890-abcd-ef1234567890",
    "requestedRole": "OBSERVER",
    "currentPhase": "ACTIVE",
    "requiredVerificationTier": "LIGHT",
    "phases": {
      "applied": {
        "completedAt": "2026-01-15T10:00:00Z",
        "hash": "sha256:1111111111111111111111111111111111111111111111111111111111111111"
      },
      "verified": {
        "completedAt": "2026-01-16T14:00:00Z",
        "hash": "sha256:2222222222222222222222222222222222222222222222222222222222222222"
      },
      "provisioned": {
        "completedAt": "2026-01-17T09:00:00Z",
        "hash": "sha256:3333333333333333333333333333333333333333333333333333333333333333"
      },
      "dryRunPassed": {
        "completedAt": "2026-01-25T15:00:00Z",
        "hash": "sha256:4444444444444444444444444444444444444444444444444444444444444444",
        "exercisesCompleted": 2,
        "score": 95
      },
      "certified": {
        "completedAt": "2026-01-27T10:00:00Z",
        "hash": "sha256:5555555555555555555555555555555555555555555555555555555555555555"
      },
      "activated": {
        "completedAt": "2026-01-28T14:30:00Z",
        "hash": "sha256:6666666666666666666666666666666666666666666666666666666666666666"
      }
    },
    "dryRunExercises": [
      {
        "exerciseId": "EX-11111111",
        "type": "REPORT",
        "status": "PASSED",
        "score": 92,
        "feedback": "Good metrics report structure",
        "completedAt": "2026-01-22T11:00:00Z"
      },
      {
        "exerciseId": "EX-22222222",
        "type": "REPORT",
        "status": "PASSED",
        "score": 98,
        "feedback": "Excellent weekly report",
        "completedAt": "2026-01-25T15:00:00Z"
      }
    ],
    "certificationChecklist": {
      "verificationComplete": true,
      "dryRunPassed": true,
      "charterAcknowledged": true,
      "emergencyContactProvided": true,
      "slaCommitmentSigned": true
    },
    "expiresAt": "2026-02-14T10:00:00Z",
    "startedAt": "2026-01-15T10:00:00Z",
    "completedAt": "2026-01-28T14:30:00Z",
    "lastUpdatedAt": "2026-01-28T14:30:00Z"
  },
  {
    "onboardingId": "ONB-b2c3d4e5",
    "operatorId": "OP-b2c3d4e5-f6a7-8901-bcde-f23456789012",
    "requestedRole": "VALIDATOR",
    "currentPhase": "ACTIVE",
    "requiredVerificationTier": "STANDARD",
    "phases": {
      "applied": {
        "completedAt": "2026-01-10T08:00:00Z",
        "hash": "sha256:aaaaaaaaaaaaaaaaaaaaaaaaaaaaaaaaaaaaaaaaaaaaaaaaaaaaaaaaaaaaaaaa"
      },
      "verified": {
        "completedAt": "2026-01-14T12:00:00Z",
        "hash": "sha256:bbbbbbbbbbbbbbbbbbbbbbbbbbbbbbbbbbbbbbbbbbbbbbbbbbbbbbbbbbbbbbbb"
      },
      "provisioned": {
        "completedAt": "2026-01-15T10:00:00Z",
        "hash": "sha256:cccccccccccccccccccccccccccccccccccccccccccccccccccccccccccccccc"
      },
      "dryRunPassed": {
        "completedAt": "2026-01-19T16:00:00Z",
        "hash": "sha256:dddddddddddddddddddddddddddddddddddddddddddddddddddddddddddddddd",
        "exercisesCompleted": 4,
        "score": 97
      },
      "certified": {
        "completedAt": "2026-01-20T09:00:00Z",
        "hash": "sha256:eeeeeeeeeeeeeeeeeeeeeeeeeeeeeeeeeeeeeeeeeeeeeeeeeeeeeeeeeeeeeeee"
      },
      "activated": {
        "completedAt": "2026-01-20T11:00:00Z",
        "hash": "sha256:ffffffffffffffffffffffffffffffffffffffffffffffffffffffffffffffff"
      }
    },
    "dryRunExercises": [
      {
        "exerciseId": "EX-33333333",
        "type": "REPORT",
        "status": "PASSED",
        "score": 95,
        "completedAt": "2026-01-16T10:00:00Z"
      },
      {
        "exerciseId": "EX-44444444",
        "type": "REPORT",
        "status": "PASSED",
        "score": 96,
        "completedAt": "2026-01-17T11:00:00Z"
      },
      {
        "exerciseId": "EX-55555555",
        "type": "VALIDATION",
        "packetId": "PKT-A-2026-689",
        "status": "PASSED",
        "score": 98,
        "completedAt": "2026-01-18T14:00:00Z"
      },
      {
        "exerciseId": "EX-66666666",
        "type": "VALIDATION",
        "packetId": "PKT-B-2026-921",
        "status": "PASSED",
        "score": 99,
        "completedAt": "2026-01-19T16:00:00Z"
      }
    ],
    "certificationChecklist": {
      "verificationComplete": true,
      "dryRunPassed": true,
      "charterAcknowledged": true,
      "emergencyContactProvided": true,
      "slaCommitmentSigned": true
    },
    "expiresAt": "2026-02-09T08:00:00Z",
    "startedAt": "2026-01-10T08:00:00Z",
    "completedAt": "2026-01-20T11:00:00Z",
    "lastUpdatedAt": "2026-01-20T11:00:00Z"
  }
]
